{
  "task": "confirm_price_quote",
  "trace": {
    "trace_id": "trace-1",
    "parent_span_id": "span-1",
    "turn_cost_remaining_usd": 4.5
  },
  "owner_confirmation": null,
  "owner_statement": "Eu compro a caixinha de 200 g por R$ 3,49.",
  "payload": {
    "ingredient": "Creme de leite",
    "package_quantity": 200,
    "package_unit": "g",
    "package_price": "3.49"
  }
}
