{
  "task": "adjust_budget",
  "trace": {
    "trace_id": "trace-1",
    "parent_span_id": "span-1",
    "turn_cost_remaining_usd": 4.5
  },
  "owner_confirmation": {
    "choice": "Confirmar",
    "summary": "Aumentar o orçamento em R$ 50,00"
  },
  "owner_statement": null,
  "payload": {
    "delta": "50.00"
  }
}
