{
  "task": "select_price_scenario",
  "trace": {
    "trace_id": "trace-1",
    "parent_span_id": "span-1",
    "turn_cost_remaining_usd": 4.5
  },
  "owner_confirmation": {
    "choice": "Confirmar",
    "summary": "Vender por R$ 9,90"
  },
  "owner_statement": null,
  "payload": {
    "dish_id": 3,
    "target_cmv_pct": "0.30"
  }
}
